{
  "schema_version": "3.0",
  "scope": "docker_semgrep_and_gitleaks_text_secrets",
  "target_path": "<SECURITY_GATE_ROOT>\\tests\\fixtures\\gitleaks\\secret",
  "decision": "DENY",
  "scan_status": "SUCCESS",
  "reason_code": "RISK_DETECTED",
  "docker_compose": {
    "schema_version": "1.0",
    "scope": "docker_compose_privileged_only",
    "target_path": "<SECURITY_GATE_ROOT>\\tests\\fixtures\\gitleaks\\secret",
    "scan_status": "SUCCESS",
    "decision": "ALLOW",
    "files": [
      {
        "file_path": "<SECURITY_GATE_ROOT>\\tests\\fixtures\\gitleaks\\secret\\compose.yaml",
        "decision": "ALLOW",
        "findings": [],
        "error": null
      }
    ],
    "errors": []
  },
  "semgrep": {
    "tool": "semgrep",
    "scope": "local_python_mvp_rules",
    "target_path": "<SECURITY_GATE_ROOT>\\tests\\fixtures\\gitleaks\\secret",
    "scan_status": "SUCCESS",
    "decision": "ALLOW",
    "findings": [],
    "errors": [],
    "scanned_files": 1
  },
  "gitleaks": {
    "tool": "gitleaks",
    "scope": "local_directory_text_secrets",
    "target_path": "<SECURITY_GATE_ROOT>\\tests\\fixtures\\gitleaks\\secret",
    "scan_status": "SUCCESS",
    "decision": "DENY",
    "version": "8.30.0",
    "scanned_files": 3,
    "findings": [
      {
        "tool": "gitleaks",
        "rule_id": "security-gate-lab-api-token",
        "file_path": "<SECURITY_GATE_ROOT>\\tests\\fixtures\\gitleaks\\secret\\settings.env",
        "line": 2,
        "severity": "HIGH",
        "reason_code": "SECRET_EXPOSURE",
        "decision": "DENY"
      }
    ],
    "errors": []
  },
  "findings": [
    {
      "tool": "gitleaks",
      "rule_id": "security-gate-lab-api-token",
      "file_path": "<SECURITY_GATE_ROOT>\\tests\\fixtures\\gitleaks\\secret\\settings.env",
      "line": 2,
      "severity": "HIGH",
      "reason_code": "SECRET_EXPOSURE",
      "decision": "DENY"
    }
  ]
}
